quiz_type,title_en,description_en,title_no,description_no,title_da,description_da
Car,"Pass the car theory test fast","Tackle 45 exam-style car questions with free lessons, instant feedback, and smart revisions.","Bestå bilteorien raskt","Bestå bilteoriprøven med 45 eksamenslignende spørsmål, gratis teori og umiddelbar tilbakemelding.","Bestå bilteorien hurtigt","Bestå bilteoriprøven med 45 eksamenslignende spørgsmål, gratis teori og øjeblikkelig feedback."
Bus,"Ace the bus theory exam","Master bus rules with 45 exam-style questions, free lessons, and adaptive review tailored for drivers.","Bestå bussteorien på første forsøk","Lær bussreglene med 45 eksamenslignende spørsmål, gratis teori og tilpasset repetisjon for yrkessjåfører.","Bestå busteorien i første forsøg","Lær busteori med 45 eksamenslignende spørgsmål, gratis teori og målrettet repetition til chauffører."
Truck,"Beat the truck theory test","Prepare for the heavy vehicle exam with 45 scenario-based questions, free lessons, and progress tracking.","Bestå lastebilteorien lett","Forbered deg til tungbilprøven med 45 scenariobaserte spørsmål, gratis teori og tydelig fremdrift.","Bestå lastbilteorien let","Forbered dig til tungvognsprøven med 45 scenarier, gratis teori og klar fremgangsmåling."
Tractor,"Pass tractor theory stress-free","Cover every farm-road rule with 45 realistic questions, free guides, and bite-sized explanations.","Bestå traktorteorien uten stress","Få kontroll på alle reglene med 45 realistiske spørsmål, gratis veiledning og korte forklaringer.","Bestå traktorteorien uden stress","Lær alle reglerne med 45 realistiske spørgsmål, gratis vejledning og korte forklaringer."
Motorcycle,"Crush the motorcycle theory exam","Ride through 45 scenario-based motorcycle questions, free lessons, and instant ride-ready feedback.","Bestå motorsykkelteorien nå","Kjør deg gjennom 45 MC-scenarier, gratis teori og umiddelbar feedback som gjør deg klar for veien.","Bestå motorcykelteorien nu","Kør gennem 45 MC-scenarier, gratis teori og øjeblikkelig feedback, så du er klar til vejen."
Moped,"Win the moped theory test","Practice 45 bite-sized moped questions, free lessons, and simple tips to pass on your first try.","Bestå mopedteorien første gang","Øv på 45 korte mopedspørsmål, gratis teori og enkle tips som sikrer bestått på første forsøk.","Bestå knallertteorien første gang","Træn med 45 korte knallertspørgsmål, gratis teori og klare tips til at bestå i første forsøg."
Boat,"Sail through the boat license test","Chart 45 realistic boating questions, free navigation lessons, and shore up every rule before exam day.","Bestå båtførerprøven enkelt","Naviger 45 realistiske båtfører-spørsmål, gratis teori og full kontroll før eksamen.","Bestå speedbådscertifikatet nemt","Naviger 45 realistiske sejlads-spørgsmål, gratis teori og fuldt overblik før prøven."
Trailer,"Master the trailer endorsement","Handle 45 towing scenarios, free checklists, and confidence-building feedback tailored to BE candidates.","Bestå tilhengerteorien med kontroll","Håndter 45 trekk-scenarier, gratis sjekklister og trygghetsbyggende tilbakemeldinger for BE-kandidater.","Bestå trailerteorien med ro","Klar 45 trækscenarier, gratis tjeklister og sikker feedback målrettet BE-kandidater."
